{
  "saleId": "01K5VB000000000SR001000482",
  "productId": "01K5T0Q8C4000000000000P001",
  "originalLineId": null,
  "position": 1,
  "name": "Warburtons Toastie White Bread 800g",
  "barcode": "0400001042175",
  "unitId": null,
  "qty": 1,
  "unitPrice": 1.45,
  "lineDiscount": 0,
  "discountSource": "manual",
  "promotionId": null,
  "promotionDiscount": 0,
  "promotionName": "",
  "discountReason": "",
  "couponDiscount": 0,
  "vatRateId": "01K5T0Q8C4000000000000V002",
  "vatPercentage": 0,
  "vatAmount": 0.00,
  "depositAmount": 0,
  "costAtSale": 0.9800,
  "restockFlag": false,
  "isDamaged": false,
  "reasonId": null,
  "ageVerifiedDob": null,
  "isPmpPriced": false,
  "isAgeRestricted": false,
  "isWeighed": false,
  "isBagCharge": false,
  "isCharityRoundUp": false,
  "goodsTotal": 1.45,
  "lineTotal": 1.45,
  "id": "01K5VB0000000SN1R001000482",
  "companyId": "01K5T0Q8C4000000000000C001",
  "createdAt": "2026-09-23T09:41:12Z",
  "updatedAt": "2026-09-23T09:41:12Z",
  "rowVersion": 1,
  "deletedAt": null,
  "isDeleted": false,
  "domainEvents": []
}
